{
  "format": "vrm",
  "status": "contract_ready",
  "requiredHumanoidBones": [
    "hips",
    "spine",
    "chest",
    "neck",
    "head",
    "leftUpperArm",
    "leftLowerArm",
    "leftHand",
    "rightUpperArm",
    "rightLowerArm",
    "rightHand",
    "leftUpperLeg",
    "leftLowerLeg",
    "leftFoot",
    "rightUpperLeg",
    "rightLowerLeg",
    "rightFoot"
  ],
  "missingHumanoidBones": [],
  "expressions": ["neutral", "happy", "blink", "surprised"],
  "notes": [
    "MVP VRM exports include humanoid metadata.",
    "Runtime animation requires replacing the placeholder scene with rigged geometry."
  ]
}
